[
  {
    "id": "FXHY-20260619-PR-001",
    "category": "政策趋势与监管",
    "title": "新能源重卡规模化应用实施方案发布",
    "summary": "交通运输部网站2026年6月15日报道，交通运输部、国家发展改革委等十一部门联合印发《推动新能源重卡规模化应用实施方案》，提出到2030年新能源重卡渗透率达到40%、保有量突破160万辆、建设零碳公路运输通道3万公里、支持并引导建设重卡充换电站3000个左右。",
    "published_at": "2026-06-15",
    "stars": "★★★★★",
    "score": 90,
    "entities": ["交通运输部", "国家发展改革委", "新能源重卡"],
    "competitor_relation": null,
    "fields": {
      "政策方向": "新能源重卡规模化应用、零碳公路运输通道、补能设施、运营监管和保险支持",
      "核心内容": "方案围绕补能设施建设、全场景应用支持、运营服务和监管体系、科技创新和标准体系部署17项任务。",
      "趋势分析": "新能源重卡政策从车辆推广走向车辆、货源、补能、监管、保险、标准一体化推进。",
      "对丰图的启示": "丰图相关地图、路径、站点和车辆数据能力可能为丰行能源车后、车队运营和监管平台提供底层支撑，具体产品归属、协同方式及商业化状态待内部确认。",
      "官方原文链接": "https://www.mot.gov.cn/xinwen/jiaotongyaowen/202606/t20260615_4207518.html",
      "解读链接": "https://www.mot.gov.cn/xinwen/jiaotongyaowen/202606/t20260615_4207522.html"
    },
    "source": {
      "name": "交通运输部网站 / 中国交通新闻网",
      "url": "https://www.mot.gov.cn/xinwen/jiaotongyaowen/202606/t20260615_4207518.html",
      "tier": "A/B",
      "is_original": false
    },
    "evidence": ["2030年新能源重卡渗透率达到40%", "建设零碳公路运输通道3万公里", "支持并引导建设重卡充换电站3000个左右", "建设新能源重卡及补能设施运营服务和监管信息平台"],
    "source_facts": "十一部门联合印发实施方案，提出2030年目标和17项重点任务。",
    "business_inference": "政策可能催生补能选址、任务-能耗联动、车辆监管、保险支持和车队能源运营需求。",
    "implication_for_fengxing": "丰行应将新能源重卡政策拆解为能源车后、车队数智化、保险风控和监管平台的联动机会。",
    "recommended_actions": ["整理新能源重卡政策任务拆解表", "建立重点区域和重点场景跟踪表", "核实现有能源/补能决策服务可公开能力"],
    "uncertainties": ["正式公文原文待补核", "丰行能源业务当前产品状态待人工确认"],
    "review_status": "待人工审核草稿"
  },
  {
    "id": "FXHY-20260619-PR-002",
    "category": "政策趋势与监管",
    "title": "五年提升千个主要货运节点多式联运功能",
    "summary": "交通运输部网站2026年6月16日报道，交通运输部等八部门联合印发《实施多式联运攻坚 打通堵点卡点行动方案（2026—2030年）》，提出用5年左右推动1000个左右主要货运节点提升多式联运功能，多式联运1小时换装率超过90%。",
    "published_at": "2026-06-16",
    "stars": "★★★★",
    "score": 86,
    "entities": ["交通运输部", "主要货运节点", "多式联运经营人"],
    "competitor_relation": null,
    "fields": {
      "政策方向": "多式联运、主要货运节点、信息联通和标准规则衔接",
      "核心内容": "行动方案要求完善设施体系、建设开放共享的信息联通体系、完善标准体系、建立政企协同企业服务体系。",
      "趋势分析": "货主运输管理将从单一公路执行向跨方式协同、节点协同和全过程管控升级。",
      "对丰图的启示": "丰图相关地图、节点、路径和数据治理能力可能为丰行 OTMS、网络货运和园区/场所数字化提供底层支撑，具体归属和商业化状态待内部确认。",
      "官方原文链接": "https://www.mot.gov.cn/xinwen/jiaotongyaowen/202606/t20260616_4207586.html",
      "解读链接": ""
    },
    "source": {
      "name": "交通运输部网站 / 中国交通新闻网",
      "url": "https://www.mot.gov.cn/xinwen/jiaotongyaowen/202606/t20260616_4207586.html",
      "tier": "A/B",
      "is_original": false
    },
    "evidence": ["推动1000个左右主要货运节点提升多式联运功能", "多式联运1小时换装率超过90%", "实现客户一站式下单、单证信息自动流转、货物信息全程追溯、数据实时共享"],
    "source_facts": "八部门联合印发行动方案，要求提升货运节点多式联运功能并推进信息联通。",
    "business_inference": "多式联运节点建设可能带动货主 OTMS、物流园区协同、单证流转和跨方式结算需求。",
    "implication_for_fengxing": "丰行应补充主要货运节点协同和多式联运流程能力评估。",
    "recommended_actions": ["建立重点货运节点政策跟踪表", "形成多式联运信息联通能力差距表", "跟踪后续地方项目和平台采购"],
    "uncertainties": ["八部门正式文件原文待补核", "丰行多式联运服务边界待确认"],
    "review_status": "待人工审核草稿"
  },
  {
    "id": "FXHY-20260619-CO-001",
    "category": "资金与项目机会",
    "title": "广东明年底前实现“超充县县通”",
    "summary": "交通运输部网站2026年6月15日报道，广东发布电动汽车充电设施高质量发展行动方案，提出到2027年底全省累计建成300万个以上充电设施，并围绕重卡等商用车物流配送固定路线规划布局重卡充换电设施。",
    "published_at": "2026-06-15",
    "stars": "★★★★",
    "score": 82,
    "entities": ["广东省", "重卡充换电设施", "高速公路服务区"],
    "competitor_relation": null,
    "fields": {
      "机会类型": "区域补能基础设施建设 / 新能源重卡运营服务机会",
      "牵头主体": "广东省相关部门，具体实施主体待补核",
      "涉及地区/行业": "广东；港口码头、矿区、集装箱堆场、大型物流集散地、工业厂房仓库、高速服务区、商用车物流配送",
      "可跟进点": "跟踪广东重卡补能设施规划、服务区超充站、物流节点充换电项目和后续招采；丰图相关地图、站点和路径能力可能提供支撑，丰行产品归属待确认。"
    },
    "source": {
      "name": "交通运输部网站 / 中国交通新闻网",
      "url": "https://www.mot.gov.cn/xinwen/jiaotongyaowen/202606/t20260615_4207523.html",
      "tier": "B/A",
      "is_original": false
    },
    "evidence": ["2027年底全省累计建成300万个以上充电设施", "规划布局重卡充换电设施", "新建电动重卡超充站的服务区不少于32对"],
    "source_facts": "广东行动方案提出充电设施总体目标和重卡补能设施重点场景。",
    "business_inference": "广东重卡补能建设可能带来站点选址、车桩匹配、补能路径和能源成本联动需求。",
    "implication_for_fengxing": "丰行应优先建立广东重卡补能机会地图和客户/项目线索表。",
    "recommended_actions": ["跟踪广东行动方案原文", "梳理港口、矿区、物流园区和高速服务区线索", "核实可跟进销售资源"],
    "uncertainties": ["广东省原始文件和具体招标待补核", "是否存在明确预算和业主单位待确认"],
    "review_status": "待人工审核草稿"
  },
  {
    "id": "FXHY-20260619-MT-001",
    "category": "市场与客户趋势",
    "title": "今年我国冷链物流市场规模有望超5850亿元",
    "summary": "交通运输部网站2026年6月12日报道，中国物流与采购联合会发布《中国冷链物流发展报告（2026）》，报告称今年我国冷链物流市场规模有望超过5850亿元，“中央厨房+冷链”“医药+冷链”“即时零售+冷链”等模式逐步进入成熟发展期。",
    "published_at": "2026-06-12",
    "stars": "★★★",
    "score": 77,
    "entities": ["中国物流与采购联合会", "冷链物流"],
    "competitor_relation": null,
    "fields": {
      "客户行业": "冷链物流、医药冷链、即时零售、中央厨房、跨境冷链",
      "需求变化": "冷链从仓储运输保障转向时效、温控、跨境、即时履约和供应链韧性协同。",
      "业务痛点": "在途温控、ETA、异常预警、承运商履约、跨境协同、结算核验和车辆安全。",
      "丰图契合点": "丰图相关地图、路径、地址和交通数据能力可能支撑丰行货主运输数字化、在途监控和动态调度，具体产品归属待内部确认。"
    },
    "source": {
      "name": "交通运输部网站 / 中国水运网",
      "url": "https://www.mot.gov.cn/xinwen/jiaotongyaowen/202606/t20260612_4207392.html",
      "tier": "B",
      "is_original": false
    },
    "evidence": ["我国冷链物流市场规模有望超过5850亿元", "中央厨房+冷链、医药+冷链、即时零售+冷链逐步成熟", "跨境冷链生态持续升级"],
    "source_facts": "中物联报告显示冷链物流规模和多场景成熟趋势。",
    "business_inference": "冷链客户可能更需要在途可视、异常预警、动态调度和承运商绩效管理。",
    "implication_for_fengxing": "丰行可将冷链列为货主运输数字化专项场景。",
    "recommended_actions": ["梳理冷链客户场景", "筛选冷链 TMS/运输管理招标", "准备客户访谈提纲"],
    "uncertainties": ["中物联报告全文待补核", "行业趋势不等于明确采购机会"],
    "review_status": "待人工审核草稿"
  },
  {
    "id": "FXHY-20260619-PT-001",
    "category": "技术与能力演进",
    "title": "交通运输数据要素“乘数效应”加速释放",
    "summary": "交通运输部网站2026年6月12日报道，交通运输部持续推动数据要素与交通运输深度融合，综合交通运输数据资源库汇集高价值数据近500项；2026年“数据要素×”交通运输赛道设置全域物流供应链数据融合、拥堵智能预警、高速公路数据上图上车等内容。",
    "published_at": "2026-06-12",
    "stars": "★★★★",
    "score": 85,
    "entities": ["交通运输部", "国家数据局", "数据要素×"],
    "competitor_relation": null,
    "fields": {
      "技术/能力方向": "交通运输高质量数据集、综合交通运输大模型智能体、数据上图上车、全域物流供应链数据融合",
      "核心变化": "交通数据从平台汇聚走向高质量数据集、场景智能体、跨区域流通和可复用应用。",
      "应用场景": "物流供应链数据融合、拥堵预警、运行监测、安全监管、政务服务、高速公路数据上图上车。",
      "能力启示": "丰行相关能力需要做到数据可治理、可审计、可授权、可参与建模，并能落到运输、车队、监管和风控场景。"
    },
    "source": {
      "name": "交通运输部网站 / 中国交通新闻网",
      "url": "https://www.mot.gov.cn/xinwen/jiaotongyaowen/202606/t20260612_4207395.html",
      "tier": "A/B",
      "is_original": false
    },
    "evidence": ["综合交通运输数据资源库汇集高价值数据近500项", "培育出109个能用、好用的智能体", "2026年赛题包括全域物流供应链数据融合和高速公路数据上图上车"],
    "source_facts": "交通运输部介绍数据要素、人工智能场景和交通运输赛道设置。",
    "business_inference": "交通数据能力竞争正在转向数据治理、智能体、上图上车和跨主体流通。",
    "implication_for_fengxing": "丰行应评估货运地图、车辆轨迹、运输任务和安全监管数据能否形成可复用数据资产。",
    "recommended_actions": ["跟踪数据要素×交通运输赛道", "评估可参与场景", "明确内部数据合规边界"],
    "uncertainties": ["国家数据局发布会原文待补核", "内部数据商业化边界需人工确认"],
    "review_status": "待人工审核草稿"
  }
]
